{"board_contract_sha256":"2e8d4eae8df477d82085143f14defe72ec4c3834e3ef81a84d404ba8d58d4e1e","canonical_board_sha256":"b83a8a2e630cfbcca6c47e3851b438d657fbbd42366492754b3646bcad84896a","display_board_sha256":"b83a8a2e630cfbcca6c47e3851b438d657fbbd42366492754b3646bcad84896a","fallback_counts":{"PPR_or_unsupported_R0":449,"publication_not_approved_R0":2023},"frozen_rows":[],"packaged_at":"2026-10-27T18:39:25.589672+00:00","prepared_at":"2026-10-27T18:39:25.589672+00:00","publication_review_sha256":"44136fa355b3678a1146ad16f7e8649e94fb4fc21fe77e8310c060f61caaff8a","registration_id":"weekly-adaptive-release-v1","rows":[],"schema_version":"weekly-adaptive-public-overlay-v1","season":2026,"state":"DISABLED_USE_R0","website_source_sha":"453e7e6e843b0cb1ae611b0925063e0f96c70196","week":8}