{"board_contract_sha256":"146387ef198c8b340d83c98aa79d0627282d809f8bfcd2522bf467e162070380","canonical_board_sha256":"255d695ddcc658225395ebfe298a82949a17006165b4aa42e9891f6af39e5114","display_board_sha256":"255d695ddcc658225395ebfe298a82949a17006165b4aa42e9891f6af39e5114","fallback_counts":{"PPR_or_unsupported_R0":448,"publication_not_approved_R0":2016},"frozen_rows":[],"packaged_at":"2026-10-28T22:37:46.647042+00:00","prepared_at":"2026-10-28T22:37:46.647042+00:00","publication_review_sha256":"44136fa355b3678a1146ad16f7e8649e94fb4fc21fe77e8310c060f61caaff8a","registration_id":"weekly-adaptive-release-v1","rows":[],"schema_version":"weekly-adaptive-public-overlay-v1","season":2026,"state":"DISABLED_USE_R0","website_source_sha":"0a4add20dcb4ebfb1f536700f86efe4caf200544","week":8}