{"board_contract_sha256":"0d6644fb15578b86bc7e0e02da0a58d40d735239a6fbe2c9741b5626c96d4e35","canonical_board_sha256":"adb384f41c1356638e1b3bd9232aec32a83fa343cbdee28625463b91d35e194d","display_board_sha256":"adb384f41c1356638e1b3bd9232aec32a83fa343cbdee28625463b91d35e194d","fallback_counts":{"PPR_or_unsupported_R0":448,"publication_not_approved_R0":2016},"frozen_rows":[],"packaged_at":"2026-10-28T22:33:23.576289+00:00","prepared_at":"2026-10-28T22:33:23.576289+00:00","publication_review_sha256":"44136fa355b3678a1146ad16f7e8649e94fb4fc21fe77e8310c060f61caaff8a","registration_id":"weekly-adaptive-release-v1","rows":[],"schema_version":"weekly-adaptive-public-overlay-v1","season":2026,"state":"DISABLED_USE_R0","website_source_sha":"788fd2c31a54ae87ac1d4bd5e7d9d7d2f45c0a61","week":8}