{"board_contract_sha256":"e667b929d764f09d5fe4358ea9f87b96c8124687caefbb09ad12f22e662c8427","canonical_board_sha256":"5997049de49551c2d0588336ea04cbf08ee89cae36f18bddfe50f60be7dc6faa","display_board_sha256":"5997049de49551c2d0588336ea04cbf08ee89cae36f18bddfe50f60be7dc6faa","fallback_counts":{"PPR_or_unsupported_R0":449,"publication_not_approved_R0":2019},"frozen_rows":[],"packaged_at":"2026-10-28T18:46:44.516176+00:00","prepared_at":"2026-10-28T18:46:44.516176+00:00","publication_review_sha256":"44136fa355b3678a1146ad16f7e8649e94fb4fc21fe77e8310c060f61caaff8a","registration_id":"weekly-adaptive-release-v1","rows":[],"schema_version":"weekly-adaptive-public-overlay-v1","season":2026,"state":"DISABLED_USE_R0","website_source_sha":"e336bf7a68c32267c3c3eec48892aeadcd03a90e","week":8}